PMID,Title,Source,Doi,Author_1,Author_2,Author_3,Author_4,Author_5,Author_6,Author_7,Author_8,Author_9,Author_10,Author_11,Author_12,Author_13,Author_14,Author_15,Author_16,Author_17,Author_18,Author_19,Author_20,Collective_Name,PubYear,PubMonth,PubDay,OriginalPubDate,Abstract,DOI,DOI_Link,PMC_ID,PMC_Link,MeSH_1,Keyword_1,MeSH_2,Keyword_2,MeSH_3,Keyword_3,MeSH_4,Keyword_4,MeSH_5,Keyword_5,MeSH_6,Keyword_6,MeSH_7,Keyword_7,MeSH_8,Keyword_8,MeSH_9,Keyword_9,MeSH_10,Keyword_10,MeSH_11,Keyword_11,MeSH_12,Keyword_12,MeSH_13,Keyword_13,MeSH_14,Keyword_14,MeSH_15,Keyword_15,MeSH_16,Keyword_16,MeSH_17,Keyword_17,MeSH_18,Keyword_18,MeSH_19,Keyword_19,MeSH_20,Keyword_20,MeSH_21,Keyword_21,MeSH_22,Keyword_22,MeSH_23,Keyword_23,MeSH_24,Keyword_24,MeSH_25,Keyword_25,MeSH_26,Keyword_26,MeSH_27,Keyword_27,MeSH_28,Keyword_28,MeSH_29,Keyword_29,MeSH_30,Keyword_30
"27107715","Regeneration of the lung: Lung stem cells and the development of lung mimicking devices.","Respir Res","","Schilders KA","Eenjes E","van Riet S","Poot AA","Stamatialis D","Truckenmller R","Hiemstra PS","Rottier RJ","","","","","","","","","","","","","","2016","Apr","23","2016 Apr 23","Inspired by the increasing burden of lung associated diseases in society and an growing demand to accommodate patients, great efforts by the scientific community produce an increasing stream of data that are focused on delineating the basic principles of lung development and growth, as well as understanding the biomechanical properties to build artificial lung devices. In addition, the continuing efforts to better define the disease origin, progression and pathology by basic scientists and clinicians contributes to insights in the basic principles of lung biology. However, the use of different model systems, experimental approaches and readout systems may generate somewhat conflicting or contradictory results. In an effort to summarize the latest developments in the lung epithelial stem cell biology, we provide an overview of the current status of the field. We first describe the different stem cells, or progenitor cells, residing in the homeostatic lung. Next, we focus on the plasticity of the different cell types upon several injury-induced activation or repair models, and highlight the regenerative capacity of lung cells. Lastly, we summarize the generation of lung mimics, such as air-liquid interface cultures, organoids and lung on a chip, that are required to test emerging hypotheses. Moreover, the increasing collaboration between distinct specializations will contribute to the eventual development of an artificial lung device capable of assisting reduced lung function and capacity in human patients.","10.1186/s12931-016-0358-z","https://doi.org/10.1186/s12931-016-0358-z","PMC4842297","https://www.ncbi.nlm.nih.gov/pmc/articles/PMC4842297/","Animals","Lung","Bioartificial Organs","Lung mimics","Biomimetics","Regeneration","Humans","Stem cells","Lung","Tissue engineering","Lung Transplantation","","Regeneration","","Respiration, Artificial","","Stem Cell Transplantation","","Stem Cells","","Tissue Engineering","","","","","","","","","","","","","","","","","","","","","","","","","","","","","","","","","","","","","","",""
"28237918","Optimal Control of Inspired Perfluorocarbon Temperature for Ultrafast Hypothermia Induction by Total Liquid Ventilation in an Adult Patient Model.","IEEE Trans Biomed Eng","","Nadeau M","Sage M","Kohlhauer M","Mousseau J","Vandamme J","Fortin-Pellerin E","Praud JP","Tissier R","Walti H","Micheau P","","","","","","","","","","","","2017","Dec","","2017 Dec","GOAL: Recent preclinical studies have shown that therapeutic hypothermia induced in less than 30min by total liquid ventilation (TLV) strongly improves the survival rate after cardiac arrest. When the lung is ventilated with a breathable perfluorocarbon liquid, the inspired perfluorocarbon allows us to control efficiently the cooling process of the organs. While TLV can rapidly cool animals, the cooling speed in humans remains unknown. The objective is to predict the efficiency and safety of ultrafast cooling by TLV in adult humans. METHODS: It is based on a previously published thermal model of ovines in TLV and the design of a direct optimal controller to compute the inspired perfluorocarbon temperature profile. The experimental results in an adult sheep are presented. The thermal model of sheep is subsequently projected to a human model to simulate the optimal hypothermia induction and its sensitivity to physiological parameter uncertainties. RESULTS: The results in the sheep showed that the computed inspired perfluorocarbon temperature command can avoid arterial temperature undershoot. The projection to humans revealed that mild hypothermia should be ultrafast (reached in fewer than 3min (-72C/h) for the brain and 20min (-10C/h) for the entire body). CONCLUSION: The projection to human model allows concluding that therapeutic hypothermia induction by TLV can be ultrafast and safe. SIGNIFICANCE: This study is the first to simulate ultrafast cooling by TLV in a human model and is a strong motivation to translate TLV to humans to improve the quality of life of postcardiac arrest patients.","10.1109/TBME.2017.2671741","https://doi.org/10.1109/TBME.2017.2671741","","","Adult","","Animals","","Brain","","Computer Simulation","","Fluorocarbons","","Heart Arrest","","Humans","","Hypothermia, Induced","","Liquid Ventilation","","Lung","","Models, Biological","","Sheep","","Temperature","","","","","","","","","","","","","","","","","","","","","","","","","","","","","","","","","","",""
"29425465","Excess Mucin Impairs Subglottic Epithelial Host Defense in Mechanically Ventilated Patients.","Am J Respir Crit Care Med","","Powell J","Garnett JP","Mather MW","Cooles FAH","Nelson A","Verdon B","Scott J","Jiwa K","Ruchaud-Sparagano MH","Cummings SP","Perry JD","Wright SE","Wilson JA","Pearson J","Ward C","Simpson AJ","","","","","","2018","Aug","1","2018 Aug 1","RATIONALE: Aspiration of infective subglottic secretions causes ventilator-associated pneumonia (VAP) in mechanically ventilated patients. Mechanisms underlying subglottic colonization in critical illness have not been defined, limiting strategies for targeted prevention of VAP. OBJECTIVES: To characterize subglottic host defense dysfunction in mechanically ventilated patients in the ICU; to determine whether subglottic mucin contributes to neutrophil phagocytic impairment and bacterial growth. METHODS: Prospective subglottic sampling in mechanically ventilated patients (intubated for four or more days), and newly intubated control patients (intubated for less than 30 min); isolation and culture of primary subglottic epithelial cells from control patients; laboratory analysis of host innate immune defenses. MEASUREMENTS AND MAIN RESULTS: Twenty-four patients in the ICU and 27 newly intubated control patients were studied. Subglottic ICU samples had significantly reduced microbiological diversity and contained potential respiratory pathogens. The subglottic microenvironment in the ICU was characterized by neutrophilic inflammation, significantly increased proinflammatory cytokines and neutrophil proteases, and altered physical properties of subglottic secretions, including accumulation of mucins. Subglottic mucin from ICU patients impaired the capacity of neutrophils to phagocytose and kill bacteria. Phagocytic impairment was reversible on treatment with a mucolytic agent. Subglottic mucus promoted growth and invasion of bacterial pathogens in a novel air-liquid interface model of primary human subglottic epithelium. CONCLUSIONS: Mechanical ventilation in the ICU is characterized by substantial mucin secretion and neutrophilic inflammation. Mucin impairs neutrophil function and promotes bacterial growth. Mucolytic agents reverse mucin-mediated neutrophil dysfunction. Enhanced mucus disruption and removal has potential to augment preventive benefits of subglottic drainage.","10.1164/rccm.201709-1819OC","https://doi.org/10.1164/rccm.201709-1819OC","","","Adult","critical care","Aged","mucoproteins","Critical Illness","neutrophils","Female","phagocytosis","Glottis","ventilator-associated pneumonia","Humans","","Immunity, Innate","","Inflammation","","Male","","Middle Aged","","Mucins","","Neutrophils","","Prospective Studies","","Respiration, Artificial","","Young Adult","","","","","","","","","","","","","","","","","","","","","","","","","","","","","","",""
"31210276","Innovative in vitro method to study ventilator induced lung injury.","ALTEX","","Joelsson JP","Myszor IT","Arason AJ","Ingthorsson S","Cherek P","Windels GS","Leosson K","Gudmundsson GH","Gudjonsson T","Karason S","","","","","","","","","","","","2019","","","2019","Mechanical ventilation (MV) is a life-saving therapy for critically ill patients, alleviating the work of breathing and supporting adequate gas exchange. However, MV can cause ventilator induced lung injury (VILI) by baro/volu- and atelectrauma, even lead to acute respiratory distress syndrome (ARDS), and substantially augment mortality. There is a need for specific biomarkers and novel research platforms for VILI/ARDS research to study these detrimental disorders and seek ways to avoid or prevent them. Previous in vitro studies on bronchial epithelium, cultured in air-liquid interface (ALI) conditions, have generally utilized static or constant pressure. We have developed a Cyclical Pressure ALI Device (CPAD) that enables cyclical stress on ALI cultured human bronchial cells, with the aim of mimicking the effects of MV. Using CPAD we were able to analyze differentially expressed VILI/ARDS and innate immunity associated genes along with increased expression of associated proteins. CPAD provides an easy and accessible way to analyze functional and phenotypic changes that occur during VILI and may provide a platform for future drug testing.","10.14573/altex.1901182","https://doi.org/10.14573/altex.1901182","","","Acute Lung Injury","VILI","Biomarkers","ARDS","Bronchi","lung disease","Cell Line","bronchial epithelium","Enzyme-Linked Immunosorbent Assay","","Epithelial Cells","","Humans","","Immunoblotting","","Maximal Respiratory Pressures","","Microscopy, Confocal","","Microscopy, Electron, Transmission","","Phenotype","","Positive-Pressure Respiration, Intrinsic","","Printing, Three-Dimensional","","Real-Time Polymerase Chain Reaction","","Reverse Transcription","","Tidal Volume","","Ventilator-Induced Lung Injury","","","","","","","","","","","","","","","","","","","","","","","","",""
"31334568","Pharmacological agents for adults with acute respiratory distress syndrome.","Cochrane Database Syst Rev","","Lewis SR","Pritchard MW","Thomas CM","Smith AF","","","","","","","","","","","","","","","","","","2019","Jul","23","2019 Jul 23","BACKGROUND: Acute respiratory distress syndrome (ARDS) is a life-threatening condition caused by direct or indirect injury to the lungs. Despite improvements in clinical management (for example, lung protection strategies), mortality in this patient group is at approximately 40%. This is an update of a previous version of this review, last published in 2004. OBJECTIVES: To evaluate the effectiveness of pharmacological agents in adults with ARDS on mortality, mechanical ventilation, and fitness to return to work at 12 months. SEARCH METHODS: We searched CENTRAL, MEDLINE, Embase, and CINAHL on 10 December 2018. We searched clinical trials registers and grey literature, and handsearched reference lists of included studies and related reviews. SELECTION CRITERIA: We included randomized controlled trials (RCTs) comparing pharmacological agents with control (placebo or standard therapy) to treat adults with established ARDS. We excluded trials of nitric oxide, inhaled prostacyclins, partial liquid ventilation, neuromuscular blocking agents, fluid and nutritional interventions and medical oxygen. We excluded studies published earlier than 2000, because of changes to lung protection strategies for people with ARDS since this date. DATA COLLECTION AND ANALYSIS: Two review authors independently assessed studies for inclusion, extracted data, and assessed risks of bias. We assessed the certainty of evidence with GRADE. MAIN RESULTS: We included 48 RCTs with 6299 participants who had ARDS; two included only participants with mild ARDS (also called acute lung injury). Most studies included causes of ARDS that were both direct and indirect injuries. We noted differences between studies, for example the time of administration or the size of dose, and because of unclear reporting we were uncertain whether all studies had used equivalent lung protection strategies.We included five types of agents as the primary comparisons in the review: corticosteroids, surfactants, N-acetylcysteine, statins, and beta-agonists. We included 15 additional agents (sivelestat, mesenchymal stem cells, ulinastatin, anisodimine, angiotensin-converting enzyme (ACE) inhibitor, recombinant human ACE2 (palifermin), AP301, granulocyte-macrophage colony stimulating factor (GM-CSF), levosimendan, prostacyclins, lisofylline, ketaconazole, nitroglycerins, L-2-oxothiazolidine-4-carboxylic acid (OTZ), and penehyclidine hydrochloride).We used GRADE to downgrade outcomes for imprecision (because of few studies and few participants), for study limitations (e.g. high risks of bias) and for inconsistency (e.g. differences between study data).Corticosteroids versus placebo or standard therapyCorticosteroids may reduce all-cause mortality within three months by 86 per 1000 patients (with as many as 161 fewer to 19 more deaths); however, the 95% confidence interval (CI) includes the possibility of both increased and reduced deaths (risk ratio (RR) 0.77, 95% CI 0.57 to 1.05; 6 studies, 574 participants; low-certainty evidence). Due to the very low-certainty evidence, we are uncertain whether corticosteroids make little or no difference to late all-cause mortality (later than three months) (RR 0.99, 95% CI 0.64 to 1.52; 1 study, 180 participants), or to the duration of mechanical ventilation (mean difference (MD) -4.30, 95% CI -9.72 to 1.12; 3 studies, 277 participants). We found that ventilator-free days up to day 28 (VFD) may be improved with corticosteroids (MD 4.09, 95% CI 1.74 to 6.44; 4 studies, 494 participants; low-certainty evidence). No studies reported adverse events leading to discontinuation of study medication, or fitness to return to work at 12 months (FTR).Surfactants versus placebo or standard therapyWe are uncertain whether surfactants make little or no difference to early mortality (RR 1.08, 95% CI 0.91 to 1.29; 9 studies, 1338 participants), or whether they reduce late all-cause mortality (RR 1.28, 95% CI 1.01 to 1.61; 1 study, 418 participants). Similarly, we are uncertain whether surfactants reduce the duration of mechanical ventilation (MD -2.50, 95% CI -4.95 to -0.05; 1 study, 16 participants), make little or no difference to VFD (MD -0.39, 95% CI -2.49 to 1.72; 2 studies, 344 participants), or to adverse events leading to discontinuation of study medication (RR 0.50, 95% CI 0.17 to 1.44; 2 studies, 88 participants). We are uncertain of these effects because we assessed them as very low-certainty. No studies reported FTR.N-aceytylcysteine versus placeboWe are uncertain whether N-acetylcysteine makes little or no difference to early mortality, because we assessed this as very low-certainty evidence (RR 0.64, 95% CI 0.32 to 1.30; 1 study, 36 participants). No studies reported late all-cause mortality, duration of mechanical ventilation, VFD, adverse events leading to study drug discontinuation, or FTR.Statins versus placeboStatins probably make little or no difference to early mortality (RR 0.99, 95% CI 0.78 to 1.26; 3 studies, 1344 participants; moderate-certainty evidence) or to VFD (MD 0.40, 95% CI -0.71 to 1.52; 3 studies, 1342 participants; moderate-certainty evidence). Statins may make little or no difference to duration of mechanical ventilation (MD 2.70, 95% CI -3.55 to 8.95; 1 study, 60 participants; low-certainty evidence). We could not include data for adverse events leading to study drug discontinuation in one study because it was unclearly reported. No studies reported late all-cause mortality or FTR.Beta-agonists versus placebo controlBeta-blockers probably slightly increase early mortality by 40 per 1000 patients (with as many as 119 more or 25 fewer deaths); however, the 95% CI includes the possibility of an increase as well as a reduction in mortality (RR 1.14, 95% CI 0.91 to 1.42; 3 studies, 646 participants; moderate-certainty evidence). Due to the very low-certainty evidence, we are uncertain whether beta-agonists increase VFD (MD -2.20, 95% CI -3.68 to -0.71; 3 studies, 646 participants), or make little or no difference to adverse events leading to study drug discontinuation (one study reported little or no difference between groups, and one study reported more events in the beta-agonist group). No studies reported late all-cause mortality, duration of mechanical ventilation, or FTR. AUTHORS' CONCLUSIONS: We found insufficient evidence to determine with certainty whether corticosteroids, surfactants, N-acetylcysteine, statins, or beta-agonists were effective at reducing mortality in people with ARDS, or duration of mechanical ventilation, or increasing ventilator-free days. Three studies awaiting classification may alter the conclusions of this review. As the potential long-term consequences of ARDS are important to survivors, future research should incorporate a longer follow-up to measure the impacts on quality of life.","10.1002/14651858.CD004477.pub3","https://doi.org/10.1002/14651858.CD004477.pub3","PMC6646953","https://www.ncbi.nlm.nih.gov/pmc/articles/PMC6646953/","Adrenal Cortex Hormones","","Adult","","Humans","","Neuromuscular Blocking Agents","","Pulmonary Surfactants","","Randomized Controlled Trials as Topic","","Respiration, Artificial","","Respiratory Distress Syndrome","","","","","","","","","","","","","","","","","","","","","","","","","","","","","","","","","","","","","","","","","","","","",""
"31967235","Multiple organ dysfunction caused by a foreign body in the esophagus.","Rev Bras Ter Intensiva","","Dragic S","Kovacevic P","Momcicevic D","Cavka J","Kovacevic T","Aleksic A","Jandric M","Zljutro B","Djaji V","","","","","","","","","","","","","2019","Oct","","2019 Oct-Dec","We present the case of a 71-year-old patient who was admitted to the medical intensive care unit in a state of multiple organ dysfunction. After the fourth day of applying all needed life-saving measures (vasopressor stimulation, mechanical ventilation, continuous dialysis treatment, broad spectrum antibiotic therapy, and other supportive measures), nonspecific heteroanamnestic data revealed that the patient had been having a persistent difficulty in swallowing liquids and food for a few days prior to hospital admission. After performing additional radiological and endoscopic diagnostic procedures, a foreign body was detected; a steel wire that had a length of approximately 6cm and was bent in a half had penetrated the esophagus and was projected into the seventh neckline. We managed to evacuate the foreign body endoscopically without further complications, and we stabilized our patient using additional therapeutic measures as needed. Apresentamos o caso de uma paciente de 71 anos de idade admitida  unidade de terapia intensiva clnica em condio de falncia de mltiplos rgos. Aps o quarto dia, com aplicao de todas as modalidades de suporte  vida (estmulo com vasopressores, ventilao mecnica, terapia com dilise contnua, terapia com antibiticos de amplo espectro e outras medidas de suporte), dados inespecficos fornecidos por acompanhante revelaram que a paciente vinha apresentando dificuldade persistente para deglutir lquidos e alimentos slidos por alguns dias antes da admisso ao hospital. Aps a realizao de procedimentos adicionais de diagnstico radiolgico e endoscpico, detectou-se a presena de um corpo estranho no esfago: um fragmento de fio de ao com cerca de 6 cm de comprimento e dobrado ao meio, que havia penetrado a parede do esfago e se projetava ao nvel da stima vrtebra cervical. Conseguimos remover o corpo estranho por via endoscpica sem maiores complicaes e, a seguir, estabilizar nossa paciente, com utilizao de medidas teraputicas adicionais, conforme necessrio.","10.5935/0103-507X.20190075","https://doi.org/10.5935/0103-507X.20190075","PMC7008999","https://www.ncbi.nlm.nih.gov/pmc/articles/PMC7008999/","Aged","","Endoscopy","","Esophagus","","Female","","Foreign Bodies","","Humans","","Intensive Care Units","","Multiple Organ Failure","","Respiration, Artificial","","","","","","","","","","","","","","","","","","","","","","","","","","","","","","","","","","","","","","","","","","",""
"32168331","In vitro characterization and in vivo comparison of the pulmonary outcomes of Poractant alfa and Calsurf in ventilated preterm rabbits.","PLoS One","","Guo X","Luo S","Amidani D","Rivetti C","Pieraccini G","Pioselli B","Catinella S","Murgia X","Salomone F","Xu Y","Dong Y","Sun B","","","","","","","","","","2020","","","2020","Poractant alfa and Calsurf are two natural surfactants widely used in China for the treatment of neonatal respiratory distress syndrome, which are extracted from porcine and calf lungs, respectively. The purpose of this experimental study was to compare their in vitro characteristics and in vivo effects in the improvement of pulmonary function and protection of lung injury. The biophysical properties, ultrastructure, and lipid composition of both surfactant preparations were respectively analysed in vitro by means of Langmuir-Blodgett trough (LBT), atomic force microscopy (AFM), and liquid-chromatography mass-spectrometry (LC-MS). Then, as core pharmacological activity, both head-to-head (100 and 200 mg/kg for both surfactants) and licensed dose comparisons (70 mg/kg Calsurf vs. 200 mg/kg Poractant alfa) between the two surfactants were conducted as prophylaxis in preterm rabbits with primary surfactant deficiency, assessing survival time and rate and dynamic compliance of the respiratory system (Cdyn). Intrapulmonary surfactant pools, morphometric volume density as alveolar expansion (Vv), and lung injury scores were determined post mortem. AFM and LC-MS analysis revealed qualitative differences in the ultrastructure as well as in the lipid composition of both preparations. Calsurf showed a longer plateau region of the LBT isotherm and lower film compressibility. In vivo, both surfactant preparations improved Cdyn at any dose, although maximum benefits in terms of Vv and intrapulmonary surfactant pools were seen with the 200 mg/kg dose in both surfactants. The group of animals treated with 200 mg/kg of Poractant alfa showed a prolonged survival time and rate compared to untreated but ventilated controls, and significantly ameliorated lung injury compared to Calsurf at any dose, including 200 mg/kg. The overall outcomes suggest the pulmonary effects to be dose dependent for both preparations. The group of animals treated with 200 mg/kg of Poractant alfa showed a significant reduction of mortality. Compared to Calsurf, Poractant alfa exerted better effects if licensed doses were compared, which requires further investigation.","10.1371/journal.pone.0230229","https://doi.org/10.1371/journal.pone.0230229","PMC7069639","https://www.ncbi.nlm.nih.gov/pmc/articles/PMC7069639/","Animals","","Biological Products","","China","","Humans","","Infant, Newborn","","Infant, Premature","","Lung","","Phospholipids","","Pulmonary Surfactants","","Rabbits","","Respiration, Artificial","","Respiratory Distress Syndrome, Newborn","","Swine","","","","","","","","","","","","","","","","","","","","","","","","","","","","","","","","","","",""
